{
  "goal_id": "landing-visual-defects",
  "round": 1,
  "playtester_run_id": "golden-landing-visual-defects",
  "evidence_origin": "synthetic-golden",
  "checks": [
    {
      "id": "cta-starts-trial",
      "status": "pass",
      "evidence": [
        "screenshots/placeholder.png"
      ],
      "action_log_lines": [
        1
      ]
    },
    {
      "id": "banner-dismisses",
      "status": "pass",
      "evidence": [
        "screenshots/placeholder.png"
      ],
      "action_log_lines": [
        1
      ]
    },
    {
      "id": "contact-responds",
      "status": "pass",
      "evidence": [
        "screenshots/placeholder.png"
      ],
      "action_log_lines": [
        1
      ]
    }
  ],
  "instrumented_findings": [],
  "ux_findings": [
    {
      "id": "ux-1",
      "layer": "measured",
      "rule": "viewport-overflow",
      "severity": "blocker",
      "selector": "",
      "viewport": 1280,
      "observation": "The document scrolls 312px sideways at a 1280px viewport.",
      "user_impact": "The page can be scrolled horizontally, cutting off the metrics strip.",
      "evidence": [
        "screenshots/placeholder.png"
      ],
      "measurement": {
        "metric": "horizontal_overflow",
        "actual": 312,
        "threshold": 0,
        "unit": "px",
        "approximated": false
      }
    },
    {
      "id": "ux-2",
      "layer": "measured",
      "rule": "low-legibility",
      "severity": "blocker",
      "selector": "p.subtitle",
      "viewport": 1280,
      "observation": "The hero subtitle renders at a 1.54:1 contrast ratio against white.",
      "user_impact": "The subtitle is effectively invisible.",
      "evidence": [
        "screenshots/placeholder.png"
      ],
      "measurement": {
        "metric": "contrast_ratio",
        "actual": 1.54,
        "threshold": 4.5,
        "unit": "ratio",
        "approximated": false
      }
    },
    {
      "id": "ux-3",
      "layer": "measured",
      "rule": "text-clipped",
      "severity": "blocker",
      "selector": "p.card-title",
      "viewport": 1280,
      "observation": "Card titles are cut off by overflow:hidden with no ellipsis.",
      "user_impact": "Feature names read as 'Continuous depl' with no way to see the rest.",
      "evidence": [
        "screenshots/placeholder.png"
      ],
      "measurement": {
        "metric": "overflow_x",
        "actual": 125,
        "threshold": 0,
        "unit": "px",
        "approximated": false
      }
    },
    {
      "id": "ux-4",
      "layer": "measured",
      "rule": "target-too-small",
      "severity": "blocker",
      "selector": "#dismiss",
      "viewport": 1280,
      "observation": "The banner dismiss control measures 14x14px.",
      "user_impact": "The dismiss button is hard to hit accurately.",
      "evidence": [
        "screenshots/placeholder.png"
      ],
      "measurement": {
        "metric": "min_side",
        "actual": 14,
        "threshold": 24,
        "unit": "px",
        "approximated": false
      }
    },
    {
      "id": "ux-5",
      "layer": "measured",
      "rule": "image-aspect-distortion",
      "severity": "major",
      "selector": "#logo",
      "viewport": 1280,
      "observation": "The logo's natural ratio is 1:1 but it renders at 240x80.",
      "user_impact": "The logo appears stretched.",
      "evidence": [
        "screenshots/placeholder.png"
      ],
      "measurement": {
        "metric": "aspect_drift",
        "actual": 200,
        "threshold": 2,
        "unit": "percent",
        "approximated": false
      }
    },
    {
      "id": "ux-6",
      "layer": "measured",
      "rule": "tiny-text",
      "severity": "major",
      "selector": "p.legal",
      "viewport": 1280,
      "observation": "Legal text renders at 9px.",
      "user_impact": "The legal note is uncomfortable to read.",
      "evidence": [
        "screenshots/placeholder.png"
      ],
      "measurement": {
        "metric": "font_size",
        "actual": 9,
        "threshold": 12,
        "unit": "px",
        "approximated": false
      }
    },
    {
      "id": "ux-7",
      "layer": "measured",
      "rule": "unstyled-default",
      "severity": "major",
      "selector": "#contact",
      "viewport": 1280,
      "observation": "The Contact sales button still uses user-agent default chrome.",
      "user_impact": "One control looks unfinished next to the styled primary action.",
      "evidence": [
        "screenshots/placeholder.png"
      ],
      "measurement": {
        "metric": "default_signals",
        "actual": 1,
        "threshold": 0,
        "unit": "count",
        "approximated": false
      }
    },
    {
      "id": "ux-8",
      "layer": "judged",
      "heuristic": "hierarchy-competing-emphasis",
      "severity": "minor",
      "observation": "The stretched blue logo block occupies more visual weight than the headline.",
      "user_impact": "Attention lands on a placeholder graphic instead of the value proposition.",
      "rationale": "The logo is the largest saturated area above the fold, so it wins the first fixation.",
      "confidence": "medium",
      "evidence": [
        "screenshots/placeholder.png"
      ]
    }
  ]
}
