{
  "goal_id": "memory-dead-start-button",
  "round": 1,
  "playtester_run_id": "golden-memory-dead-start-button",
  "evidence_origin": "synthetic-golden",
  "checks": [
    {
      "id": "initial-state-hidden",
      "status": "pass",
      "evidence": [
        "screenshots/placeholder.png"
      ],
      "action_log_lines": [
        1
      ]
    },
    {
      "id": "start-begins-game",
      "status": "pass",
      "evidence": [
        "screenshots/placeholder.png"
      ],
      "action_log_lines": [
        1
      ]
    },
    {
      "id": "card-flips-on-click",
      "status": "pass",
      "evidence": [
        "screenshots/placeholder.png"
      ],
      "action_log_lines": [
        1
      ]
    },
    {
      "id": "mismatch-flips-back",
      "status": "pass",
      "evidence": [
        "screenshots/placeholder.png"
      ],
      "action_log_lines": [
        1
      ]
    },
    {
      "id": "restart-resets",
      "status": "pass",
      "evidence": [
        "screenshots/placeholder.png"
      ],
      "action_log_lines": [
        1
      ]
    }
  ],
  "instrumented_findings": []
}
