{
  "goal_id": "form-loses-data-on-validation",
  "round": 1,
  "playtester_run_id": "golden-form-loses-data-on-validation",
  "evidence_origin": "synthetic-golden",
  "checks": [
    {
      "id": "invalid-email-shows-error",
      "status": "pass",
      "evidence": [
        "screenshots/placeholder.png"
      ],
      "action_log_lines": [
        1
      ]
    },
    {
      "id": "data-retained-after-error",
      "status": "fail",
      "evidence": [
        "screenshots/placeholder.png"
      ],
      "action_log_lines": [
        2,
        3
      ],
      "repro": [
        "Reproduce failure for data-retained-after-error"
      ],
      "user_facing_bug": "Email and name fields are cleared after a validation error."
    },
    {
      "id": "valid-submit-succeeds",
      "status": "pass",
      "evidence": [
        "screenshots/placeholder.png"
      ],
      "action_log_lines": [
        1
      ]
    }
  ],
  "instrumented_findings": []
}
