{
  "goal_id": "dry-run-landing",
  "round": 1,
  "playtester_run_id": "dry-run-1-manual-verification",
  "checks": [
    {
      "id": "landing-loads",
      "status": "pass",
      "evidence": ["screenshots/01_landing_loaded.png"],
      "action_log_lines": [1, 2, 3]
    },
    {
      "id": "media-url-example-visible",
      "status": "pass",
      "evidence": ["screenshots/02_media_url_example.png"],
      "action_log_lines": [4, 5]
    }
  ],
  "instrumented_findings": []
}
