{
  "goal_id": "memory-mismatch-stays-visible",
  "round": 1,
  "playtester_run_id": "golden-memory-mismatch-stays-visible",
  "evidence_origin": "synthetic-golden",
  "checks": [
    {
      "id": "start-begins-game",
      "status": "pass",
      "evidence": [
        "screenshots/placeholder.png"
      ],
      "action_log_lines": [
        1
      ]
    },
    {
      "id": "mismatch-flips-back",
      "status": "pass",
      "evidence": [
        "screenshots/placeholder.png"
      ],
      "action_log_lines": [
        1
      ]
    }
  ],
  "instrumented_findings": []
}
