{
  "goal_id": "trap-overlay-blocks-clicks",
  "round": 1,
  "playtester_run_id": "golden-trap-overlay-blocks-clicks",
  "evidence_origin": "synthetic-golden",
  "checks": [
    {
      "id": "start-begins-game",
      "status": "pass",
      "evidence": [
        "screenshots/placeholder.png"
      ],
      "action_log_lines": [
        1
      ]
    },
    {
      "id": "card-flips-on-click",
      "status": "fail",
      "evidence": [
        "screenshots/placeholder.png"
      ],
      "action_log_lines": [
        2,
        3
      ],
      "repro": [
        "Reproduce failure for card-flips-on-click"
      ],
      "user_facing_bug": "Cards do not flip; clicks appear to hit an invisible overlay."
    }
  ],
  "instrumented_findings": [],
  "ux_findings": [
    {
      "id": "ux-1",
      "layer": "measured",
      "rule": "occluded-interactive",
      "severity": "blocker",
      "selector": "div.card:nth-of-type(1)",
      "viewport": 1280,
      "observation": "Every card's centre point hit-tests to #click-shield rather than the card.",
      "user_impact": "Cards cannot be clicked at all because a transparent overlay covers the board.",
      "evidence": [
        "screenshots/placeholder.png"
      ],
      "measurement": {
        "metric": "hit_test",
        "actual": 0,
        "threshold": 1,
        "unit": "boolean",
        "approximated": false
      }
    }
  ]
}
